QuestionType;Question;QuestionID;Answer
linearGrid;Mental Demand:				How mentally demanding was the task?;g1;6
linearGrid;Physical Demand:				How physically demanding was the task?;g2;4
linearGrid;Temporal Demand:		How hurried or rushed was the pace of the task?;g3;6
linearGrid;Performance:  How succesfull were you in accomplishing what you were asked to do?;g4;20
linearGrid;Effort:  How hard did you have to work to accomplish your level of performance?;g5;4
linearGrid;Frustration:  How insecure, discouraged, irritated, stressed, and annoyed were you?;g6;1

