QuestionType;Question;QuestionID;Answer
linearGrid;Mental Demand:				How mentally demanding was the task?;g1;5
linearGrid;Physical Demand:				How physically demanding was the task?;g2;5
linearGrid;Temporal Demand:		How hurried or rushed was the pace of the task?;g3;5
linearGrid;Performance:  How succesfull were you in accomplishing what you were asked to do?;g4;14
linearGrid;Effort:  How hard did you have to work to accomplish your level of performance?;g5;5
linearGrid;Frustration:  How insecure, discouraged, irritated, stressed, and annoyed were you?;g6;5

